<?xml version="1.0" encoding="iso-8859-1" ?>
<conversations xmlns:xsi="http://www.w3.org/2001/XMLSchema-instance" xsi:noNamespaceSchemaLocation="conversations.xsd">

  <!--check TODO-->
  <!--remove the npc lines at the start when no longer needed-->

  <!--MISSION OFFERS-->
  <conversation name="L2OfferNormal" description="Basic generic mission offer">
    <player_any>
      <player text="{3800,101}" comment="looking for job" outcome="briefing"/>
      <player text="{3800,102}" comment="looking for job" outcome="briefing"/>
      <player text="{3800,104}" comment="looking for job" outcome="briefing"/>
      <npc_any>
        <npc text="{@pageid,803}" comment="I have a job going"/>
        <npc text="{@pageid,2100}" comment="I have a job going"/>
        <npc text="{@pageid,2101}" comment="I have a job going"/>
        <npc text="{@pageid,2102}" comment="I have a job going"/>
        <player_all>
          <player_any>
            <player text="{3800,201}" action="briefing"/>
            <player text="{3800,202}" action="briefing"/>
            <player text="{3800,203}" action="briefing"/>
            <player text="{3800,204}" action="briefing"/>
            <npc text="{@pageid,822}" comment="Are you interested?">
              <player_all>
                <player_any>
                  <player text="{3800,301}" outcome="accept"/>
                  <player text="{3800,302}" outcome="accept"/>
                  <player text="{3800,303}" outcome="accept"/>
                  <player text="{3800,304}" outcome="accept"/>
                  <player text="{3800,305}" outcome="accept"/>
                </player_any>
                <player_any>
                  <player text="{3800,501}" outcome="reject"/>
                  <player text="{3800,502}" outcome="reject"/>
                  <player text="{3800,503}" outcome="reject"/>
                  <player text="{3800,504}" outcome="reject"/>
                  <player text="{3800,505}" outcome="reject"/>
                  <player text="{3800,506}" outcome="reject"/>
                </player_any>
              </player_all>
            </npc>
          </player_any>
          <player_any>
            <player text="{3800,501}" outcome="reject"/>
            <player text="{3800,502}" outcome="reject"/>
            <player text="{3800,503}" outcome="reject"/>
            <player text="{3800,504}" outcome="reject"/>
            <player text="{3800,505}" outcome="reject"/>
            <player text="{3800,506}" outcome="reject"/>
          </player_any>
          <!--<player_any>
              <player text="{3800,401}" outcome="accept"/>
              <player text="{3800,402}" outcome="accept"/>
              <player text="{3800,403}" outcome="accept"/>
            </player_any>-->
        </player_all>
      </npc_any>
    </player_any>
  </conversation>  
  <conversation name="L2OfferCombat" description="Basic combat mission offer">
    <player_any>
      <player text="{3800,101}" comment="looking for job" outcome="briefing"/>
      <player text="{3800,102}" comment="looking for job" outcome="briefing"/>
      <player text="{3800,104}" comment="looking for job" outcome="briefing"/>
      <npc_any>
        <npc text="{@pageid,803} {@pageid,804}" comment="I have a job going"/>
        <npc text="{@pageid,2100} {@pageid,804}" comment="I have a job going"/>
        <npc text="{@pageid,2101} {@pageid,804}" comment="I have a job going"/>
        <npc text="{@pageid,2102} {@pageid,804}" comment="I have a job going"/>
        <npc text="{@pageid,803} {@pageid,804} {@pageid,821}" comment="I have a job going"/>
        <npc text="{@pageid,2100} {@pageid,804} {@pageid,821}" comment="I have a job going"/>
        <npc text="{@pageid,2101} {@pageid,804} {@pageid,821}" comment="I have a job going"/>
        <npc text="{@pageid,2102} {@pageid,804} {@pageid,821}" comment="I have a job going"/>
        <player_all>
          <player_any>
            <player text="{3800,201}" action="briefing"/>
            <player text="{3800,202}" action="briefing"/>
            <player text="{3800,203}" action="briefing"/>
            <player text="{3800,204}" action="briefing"/>
            <npc_any>
              <npc text="{@pageid,825} {@pageid,820}" comment="Are you interested?"/>
              <npc text="{@pageid,825} {@pageid,822}" comment="Are you interested?"/>
                <player_all>
                <player_any>
                  <player text="{3800,301}" outcome="accept"/>
                  <player text="{3800,302}" outcome="accept"/>
                  <player text="{3800,303}" outcome="accept"/>
                  <player text="{3800,304}" outcome="accept"/>
                  <player text="{3800,305}" outcome="accept"/>
                </player_any>
                <player_any>
                  <player text="{3800,501}" outcome="reject"/>
                  <player text="{3800,502}" outcome="reject"/>
                  <player text="{3800,503}" outcome="reject"/>
                  <player text="{3800,504}" outcome="reject"/>
                  <player text="{3800,505}" outcome="reject"/>
                  <player text="{3800,506}" outcome="reject"/>
                </player_any>
              </player_all>
            </npc_any>
          </player_any>
          <player_any>
            <player text="{3800,501}" outcome="reject"/>
            <player text="{3800,502}" outcome="reject"/>
            <player text="{3800,503}" outcome="reject"/>
            <player text="{3800,504}" outcome="reject"/>
            <player text="{3800,505}" outcome="reject"/>
            <player text="{3800,506}" outcome="reject"/>
          </player_any>
        </player_all>
      </npc_any>
    </player_any>
  </conversation>
  <conversation name="L2OfferCombatEasy" description="Basic combat mission offer">
    <player_any>
      <player text="{3800,101}" comment="looking for job" outcome="briefing"/>
      <player text="{3800,102}" comment="looking for job" outcome="briefing"/>
      <player text="{3800,104}" comment="looking for job" outcome="briefing"/>
      <npc_any>
        <npc text="{@pageid,803} {@pageid,804}" comment="I have a job going"/>
        <npc text="{@pageid,2100} {@pageid,804}" comment="I have a job going"/>
        <npc text="{@pageid,2101} {@pageid,804}" comment="I have a job going"/>
        <npc text="{@pageid,2102} {@pageid,804}" comment="I have a job going"/>
        <npc text="{@pageid,803} {@pageid,804} {@pageid,821}" comment="I have a job going"/>
        <npc text="{@pageid,2100} {@pageid,804} {@pageid,821}" comment="I have a job going"/>
        <npc text="{@pageid,2101} {@pageid,804} {@pageid,821}" comment="I have a job going"/>
        <npc text="{@pageid,2102} {@pageid,804} {@pageid,821}" comment="I have a job going"/>
        <player_all>
          <player_any>
            <player text="{3800,201}" action="briefing"/>
            <player text="{3800,202}" action="briefing"/>
            <player text="{3800,203}" action="briefing"/>
            <player text="{3800,204}" action="briefing"/>
            <npc_any>
              <npc text="{@pageid,825} {@pageid,830} {@pageid,820}" comment="Are you interested?"/>
              <npc text="{@pageid,825} {@pageid,830} {@pageid,822}" comment="Are you interested?"/>
              <npc text="{@pageid,830} {@pageid,820}" comment="Are you interested?"/>
              <npc text="{@pageid,830} {@pageid,822}" comment="Are you interested?"/>
              <player_all>
                <player_any>
                  <player text="{3800,301}" outcome="accept"/>
                  <player text="{3800,302}" outcome="accept"/>
                  <player text="{3800,303}" outcome="accept"/>
                  <player text="{3800,304}" outcome="accept"/>
                  <player text="{3800,305}" outcome="accept"/>
                </player_any>
                <player_any>
                  <player text="{3800,501}" outcome="reject"/>
                  <player text="{3800,502}" outcome="reject"/>
                  <player text="{3800,503}" outcome="reject"/>
                  <player text="{3800,504}" outcome="reject"/>
                  <player text="{3800,505}" outcome="reject"/>
                  <player text="{3800,506}" outcome="reject"/>
                </player_any>
              </player_all>
            </npc_any>
          </player_any>
          <player_any>
            <player text="{3800,501}" outcome="reject"/>
            <player text="{3800,502}" outcome="reject"/>
            <player text="{3800,503}" outcome="reject"/>
            <player text="{3800,504}" outcome="reject"/>
            <player text="{3800,505}" outcome="reject"/>
            <player text="{3800,506}" outcome="reject"/>
          </player_any>
        </player_all>
      </npc_any>
    </player_any>
  </conversation>
  <conversation name="L2OfferCombatHard" description="Basic combat mission offer">
    <player_any>
      <player text="{3800,101}" comment="looking for job" outcome="briefing"/>
      <player text="{3800,102}" comment="looking for job" outcome="briefing"/>
      <player text="{3800,104}" comment="looking for job" outcome="briefing"/>
      <npc_any>
        <npc text="{@pageid,803} {@pageid,804}" comment="I have a job going"/>
        <npc text="{@pageid,2100} {@pageid,804}" comment="I have a job going"/>
        <npc text="{@pageid,2101} {@pageid,804}" comment="I have a job going"/>
        <npc text="{@pageid,2102} {@pageid,804}" comment="I have a job going"/>
        <npc text="{@pageid,803} {@pageid,804} {@pageid,821}" comment="I have a job going"/>
        <npc text="{@pageid,2100} {@pageid,804} {@pageid,821}" comment="I have a job going"/>
        <npc text="{@pageid,2101} {@pageid,804} {@pageid,821}" comment="I have a job going"/>